{
  "$schema": "https://json-schema.org/draft/2020-12/schema",
  "$id": "cest://schemas/evaluation_report/v0.1.2",
  "title": "CEST Evaluation Report v0.1.2",
  "type": "object",
  "required": [
    "version", "generated_at",
    "baseline_scenario_id",
    "inputs", "results",
    "ranking", "explain_pack", "sensitivity",
    "notices"
  ],
  "properties": {
    "version": { "type": "string", "const": "v0.1.2" },
    "generated_at": { "type": "string", "format": "date-time" },
    "baseline_scenario_id": {
      "type": ["string", "null"],
      "description": "deltaの基準シナリオID。BASELINE_OFFICE_NOT_FOUNDのときnull"
    },
    "inputs": {
      "type": "object",
      "required": [
        "home_station_distribution", "office_candidates",
        "policy_as_is", "settings"
      ],
      "properties": {
        "home_station_distribution": {
          "type": "array",
          "minItems": 1,
          "items": {
            "type": "object",
            "required": ["station_id", "count"],
            "properties": {
              "station_id": { "type": "string" },
              "count": { "type": "integer", "minimum": 1 },
              "segment": { "type": ["string", "null"] },
              "office_days_per_week_override": {
                "type": ["number", "null"],
                "minimum": 0, "maximum": 5
              }
            },
            "additionalProperties": false
          }
        },
        "office_candidates": {
          "type": "array",
          "minItems": 2, "maxItems": 5,
          "items": {
            "type": "object",
            "required": ["office_id", "name", "nearest_station_id", "last_mile_minutes"],
            "properties": {
              "office_id": { "type": "string" },
              "name": { "type": "string" },
              "nearest_station_id": { "type": "string" },
              "last_mile_minutes": { "type": "number", "minimum": 0, "maximum": 60 },
              "lat": { "type": ["number", "null"] },
              "lon": { "type": ["number", "null"] },
              "rent_jpy_month": { "type": ["integer", "null"], "minimum": 0 }
            },
            "additionalProperties": false
          }
        },
        "policy_as_is": {
          "type": "object",
          "required": ["office_days_per_week"],
          "properties": {
            "office_days_per_week": { "type": "number", "minimum": 0, "maximum": 5 }
          },
          "additionalProperties": false
        },
        "settings": {
          "type": "object",
          "required": [
            "baseline_office_id",
            "thresholds_trip_minutes",
            "ranking_weights",
            "bench_trip_p95_minutes",
            "bench_rent_jpy_month",
            "robust_flip_rate_threshold",
            "routing"
          ],
          "properties": {
            "baseline_office_id": {
              "type": ["string", "null"],
              "description": "nullなら office_candidates先頭を使う"
            },
            "thresholds_trip_minutes": {
              "type": "array", "minItems": 1,
              "items": { "type": "number", "minimum": 0 }
            },
            "percentiles": {
              "type": "array",
              "const": [50, 95],
              "description": "v0.1は[50,95]固定。変更はv0.2以降"
            },
            "ranking_weights": { "$ref": "#/$defs/ranking_weights" },
            "bench_trip_p95_minutes": {
              "type": "number", "minimum": 1
            },
            "bench_rent_jpy_month": {
              "type": "number", "minimum": 1
            },
            "robust_flip_rate_threshold": {
              "type": "number", "minimum": 0, "maximum": 1
            },
            "routing": {
              "type": "object",
              "required": ["graph_id", "transfer_penalty_minutes"],
              "properties": {
                "graph_id": {
                  "type": ["string", "null"],
                  "description": "v0.1サポート: 'tokyo_core_v1'。UIに出さない"
                },
                "transfer_penalty_minutes": {
                  "type": "number", "minimum": 0, "maximum": 60,
                  "description": "v0.1は0のみ有効。非0はNotice出して無視"
                }
              },
              "additionalProperties": false
            }
          },
          "additionalProperties": false
        }
      },
      "additionalProperties": false
    },
    "results": {
      "type": "array",
      "minItems": 0,
      "items": {
        "type": "object",
        "required": [
          "scenario_id", "office_id",
          "policy_applied", "kpis",
          "coverage", "station_breakdown", "unreachable"
        ],
        "properties": {
          "scenario_id": { "type": "string" },
          "office_id": { "type": "string" },
          "policy_applied": {
            "type": "object",
            "required": ["office_days_per_week", "override_population_share"],
            "properties": {
              "office_days_per_week": {
                "type": "number", "minimum": 0, "maximum": 5
              },
              "override_population_share": {
                "type": "number", "minimum": 0, "maximum": 1
              }
            },
            "additionalProperties": false
          },
          "kpis": {
            "type": "object",
            "required": [
              "population", "population_reachable",
              "trip_minutes", "round_trip_minutes", "weekly_minutes",
              "thresholds"
            ],
            "properties": {
              "population": { "type": "integer", "minimum": 1 },
              "population_reachable": {
                "type": "integer", "minimum": 0
              },
              "trip_minutes": { "$ref": "#/$defs/three_stats" },
              "round_trip_minutes": { "$ref": "#/$defs/three_stats" },
              "weekly_minutes": { "$ref": "#/$defs/three_stats" },
              "thresholds": {
                "type": "array",
                "items": {
                  "type": "object",
                  "required": ["trip_minutes", "exceed_count", "exceed_share"],
                  "properties": {
                    "trip_minutes": { "type": "number", "minimum": 0 },
                    "exceed_count": { "type": "integer", "minimum": 0 },
                    "exceed_share": { "type": "number", "minimum": 0, "maximum": 1 }
                  },
                  "additionalProperties": false
                }
              }
            },
            "additionalProperties": false
          },
          "coverage": {
            "type": "object",
            "required": ["network_covered_ratio", "quality_label"],
            "properties": {
              "network_covered_ratio": {
                "type": "number", "minimum": 0, "maximum": 1
              },
              "quality_label": {
                "type": "string",
                "enum": ["computed", "computed_simple"]
              }
            },
            "additionalProperties": false
          },
          "station_breakdown": {
            "type": "array",
            "items": {
              "type": "object",
              "required": ["station_id", "count", "reachable", "trip_minutes", "threshold_results"],
              "properties": {
                "station_id": { "type": "string" },
                "count": { "type": "integer", "minimum": 1 },
                "reachable": {
                  "type": "boolean"
                },
                "trip_minutes": {
                  "type": ["number", "null"],
                  "minimum": 0
                },
                "threshold_results": {
                  "type": "array",
                  "items": {
                    "type": "object",
                    "required": ["trip_minutes", "exceeds"],
                    "properties": {
                      "trip_minutes": { "type": "number", "minimum": 0 },
                      "exceeds": {
                        "type": "boolean"
                      }
                    },
                    "additionalProperties": false
                  }
                },
                "delta_vs_baseline_trip_minutes": {
                  "type": ["number", "null"]
                }
              },
              "additionalProperties": false
            }
          },
          "unreachable": {
            "type": "object",
            "required": ["count", "stations"],
            "properties": {
              "count": { "type": "integer", "minimum": 0 },
              "stations": {
                "type": "array",
                "items": {
                  "type": "object",
                  "required": ["station_id", "count"],
                  "properties": {
                    "station_id": { "type": "string" },
                    "count": { "type": "integer", "minimum": 1 }
                  },
                  "additionalProperties": false
                }
              }
            },
            "additionalProperties": false
          }
        },
        "additionalProperties": false
      }
    },
    "ranking": {
      "type": "object",
      "required": ["weights_normalized", "axes", "overall", "best_scenario_id"],
      "properties": {
        "weights_normalized": {
          "$ref": "#/$defs/ranking_weights",
          "description": "バックエンドで正規化済み（合計=1）"
        },
        "axes": {
          "type": "object",
          "required": ["access", "financial", "environmental"],
          "properties": {
            "access": { "$ref": "#/$defs/axis_scores" },
            "financial": { "$ref": "#/$defs/axis_scores" },
            "environmental": { "$ref": "#/$defs/axis_scores" }
          },
          "additionalProperties": false
        },
        "overall": {
          "type": "array",
          "items": {
            "type": "object",
            "required": ["scenario_id", "overall_score_0_100"],
            "properties": {
              "scenario_id": { "type": "string" },
              "overall_score_0_100": {
                "type": "number", "minimum": 0, "maximum": 100
              }
            },
            "additionalProperties": false
          }
        },
        "best_scenario_id": {
          "type": ["string", "null"]
        }
      },
      "additionalProperties": false
    },
    "explain_pack": {
      "type": "object",
      "required": ["tradeoffs", "if_you_prioritize"],
      "properties": {
        "tradeoffs": {
          "type": "array",
          "maxItems": 2,
          "items": { "type": "string" }
        },
        "if_you_prioritize": {
          "type": "object",
          "properties": {
            "access": { "type": "array", "items": { "type": "string" } },
            "financial": { "type": "array", "items": { "type": "string" } }
          },
          "additionalProperties": false
        }
      },
      "additionalProperties": false
    },
    "sensitivity": {
      "type": "object",
      "required": [
        "robust", "flip_rate",
        "critical_assumption", "summary", "next_action",
        "variants"
      ],
      "properties": {
        "robust": { "type": "boolean" },
        "flip_rate": { "type": "number", "minimum": 0, "maximum": 1 },
        "critical_assumption": {
          "type": "string",
          "enum": ["last_mile_minutes"]
        },
        "summary": { "type": "string" },
        "next_action": { "type": "string" },
        "variants": {
          "type": "array",
          "items": {
            "type": "object",
            "required": ["variant_id", "assumptions", "best_scenario_id"],
            "properties": {
              "variant_id": { "type": "string" },
              "assumptions": { "type": "object", "additionalProperties": true },
              "best_scenario_id": { "type": ["string", "null"] }
            },
            "additionalProperties": false
          }
        }
      },
      "additionalProperties": false
    },
    "notices": {
      "type": "array",
      "items": {
        "type": "object",
        "required": ["level", "code", "message", "actionability"],
        "properties": {
          "level": { "type": "string", "enum": ["info", "warning", "error"] },
          "code": { "type": "string" },
          "message": { "type": "string" },
          "action": { "type": ["string", "null"] },
          "actionability": {
            "type": "string",
            "enum": ["needs_action", "informational", "blocking"]
          }
        },
        "additionalProperties": false
      }
    }
  },
  "$defs": {
    "three_stats": {
      "type": "object",
      "required": ["avg", "p50", "p95"],
      "properties": {
        "avg": { "type": ["number", "null"], "minimum": 0 },
        "p50": { "type": ["number", "null"], "minimum": 0 },
        "p95": { "type": ["number", "null"], "minimum": 0 }
      },
      "description": "population_reachable==0のとき全フィールドがnull",
      "additionalProperties": false
    },
    "ranking_weights": {
      "type": "object",
      "required": ["access", "financial", "environmental"],
      "properties": {
        "access": { "type": "number", "minimum": 0, "maximum": 1 },
        "financial": { "type": "number", "minimum": 0, "maximum": 1 },
        "environmental": { "type": "number", "minimum": 0, "maximum": 1 }
      },
      "additionalProperties": false
    },
    "axis_scores": {
      "type": "array",
      "items": {
        "type": "object",
        "required": ["scenario_id", "score_0_100", "inputs_available", "quality_label"],
        "properties": {
          "scenario_id": { "type": "string" },
          "score_0_100": {
            "type": ["number", "null"],
            "minimum": 0, "maximum": 100
          },
          "inputs_available": { "type": "boolean" },
          "quality_label": {
            "type": "string",
            "enum": ["computed", "computed_simple", "input_proxy"]
          }
        },
        "additionalProperties": false
      }
    }
  },
  "additionalProperties": false
}
